Package	Class	Method	CC	NOCL	NOS	HLTH	HVOC	HEFF	HBUG	CREF	XMET	LMET	NLOC	NOC	NOA	MOD	HDIF	VDEC	EXCT	EXCR	CAST	TDN	HVOL	NAND	VREF	NOPR	MDN	NEXP	LOOP	FLAG	SEQUENCE	DEFECTIVE
com.mountainminds.eclemma.core.launching	com.mountainminds.eclemma.core.launching.JavaApplicationLauncherTest	com.mountainminds.eclemma.core.launching.JavaApplicationLauncherTest getJavaApplicationType()	1	0	2	18	13	199.823744779619	0.022202638308846556	1	1	0	7	0	0	1	3.0	0	0	0	0	0	66.60791492653966	7	0	11	0	2	0	TESTCODE	METHOD IDENTIFIER BLOCK RETURN METHOD_INVOCATION MEMBER_SELECT METHOD_INVOCATION MEMBER_SELECT METHOD_INVOCATION MEMBER_SELECT IDENTIFIER STRING_LITERAL	FALSE
com.mountainminds.eclemma.internal.core	com.mountainminds.eclemma.internal.core.DebugOptions$ITracer	com.mountainminds.eclemma.internal.core.DebugOptions$ITracer startMemoryUsage()	1	3	1	5	5	17.414460711655217	0.0038698801581456034	0	0	0	1	1	0	1	1.5	0	0	0	0	0	11.60964047443681	2	0	3	0	0	0	INTERFACE	METHOD PRIMITIVE_TYPE	FALSE
com.mountainminds.eclemma.internal.ui	com.mountainminds.eclemma.internal.ui.ScopeViewer$PackageFragmentRootLabelProvider	com.mountainminds.eclemma.internal.ui.ScopeViewer$PackageFragmentRootLabelProvider dispose()	1	0	2	10	8	99.99999999999999	0.01	0	1	0	3	0	0	1	3.333333333333333	0	0	0	0	0	30.0	4	1	6	0	0	0	NORMAL	METHOD PRIMITIVE_TYPE BLOCK EXPRESSION_STATEMENT METHOD_INVOCATION MEMBER_SELECT IDENTIFIER	FALSE
com.mountainminds.eclemma.internal.ui.wizards	com.mountainminds.eclemma.internal.ui.wizards.SessionExportPage1	com.mountainminds.eclemma.internal.ui.wizards.SessionExportPage1 getDestination()	1	0	2	14	11	145.2961279827665	0.016144014220307392	1	1	0	3	0	0	1	3.0	0	0	0	0	0	48.43204266092217	5	1	9	0	1	0	GETTER	METHOD IDENTIFIER BLOCK RETURN METHOD_INVOCATION MEMBER_SELECT METHOD_INVOCATION MEMBER_SELECT IDENTIFIER	FALSE
com.mountainminds.eclemma.core	com.mountainminds.eclemma.core.ISessionManager	com.mountainminds.eclemma.core.ISessionManager refreshActiveSession()	1	4	1	5	5	17.414460711655217	0.0038698801581456034	0	0	0	1	1	0	1	1.5	0	0	0	0	0	11.60964047443681	2	0	3	0	0	0	INTERFACE	METHOD PRIMITIVE_TYPE	FALSE
com.mountainminds.eclemma.internal.core	com.mountainminds.eclemma.internal.core.SessionManagerTest$DummySession	com.mountainminds.eclemma.internal.core.SessionManagerTest$DummySession getAdapter(LClass;)	1	0	2	9	9	71.32331253245204	0.009509775004326938	1	0	0	3	0	1	1	2.5	0	0	0	0	0	28.529325012980813	4	0	5	0	1	0	TESTCODE	METHOD IDENTIFIER VARIABLE ANNOTATION IDENTIFIER STRING_LITERAL IDENTIFIER BLOCK RETURN NULL_LITERAL	FALSE
com.mountainminds.eclemma.internal.ui.coverageview	com.mountainminds.eclemma.internal.ui.coverageview.SelectSessionAction	com.mountainminds.eclemma.internal.ui.coverageview.SelectSessionAction <init>()	1	0	7	43	20	487.83763371041107	0.06194763602671887	1	1	0	10	0	0	0	2.625	0	0	0	0	0	185.8429080801566	21	4	22	0	8	0	CONSTRUCTOR	METHOD BLOCK EXPRESSION_STATEMENT METHOD_INVOCATION IDENTIFIER MEMBER_SELECT IDENTIFIER EXPRESSION_STATEMENT METHOD_INVOCATION IDENTIFIER MEMBER_SELECT IDENTIFIER EXPRESSION_STATEMENT METHOD_INVOCATION IDENTIFIER METHOD_INVOCATION MEMBER_SELECT IDENTIFIER MEMBER_SELECT IDENTIFIER EXPRESSION_STATEMENT METHOD_INVOCATION IDENTIFIER METHOD_INVOCATION MEMBER_SELECT IDENTIFIER MEMBER_SELECT IDENTIFIER EXPRESSION_STATEMENT METHOD_INVOCATION IDENTIFIER IDENTIFIER EXPRESSION_STATEMENT METHOD_INVOCATION IDENTIFIER BOOLEAN_LITERAL	FALSE
com.mountainminds.eclemma.core	com.mountainminds.eclemma.core.ISessionManager	com.mountainminds.eclemma.core.ISessionManager removeSession(LICoverageSession;)	1	8	1	7	7	29.47722668160484	0.00655049481813441	1	0	0	1	1	1	1	1.5	0	0	0	0	0	19.651484454403228	4	0	3	0	0	0	INTERFACE	METHOD PRIMITIVE_TYPE VARIABLE IDENTIFIER	FALSE
com.mountainminds.eclemma.internal.core	com.mountainminds.eclemma.internal.core.ExecutionDataFiles	com.mountainminds.eclemma.internal.core.ExecutionDataFiles deleteTemporaryFiles()	2	3	5	28	18	802.7105627776451	0.03891930001346158	1	1	0	6	1	0	1	6.875	1	0	0	0	1	116.75790004038474	11	2	17	1	2	1	NORMAL	METHOD PRIMITIVE_TYPE BLOCK VARIABLE ARRAY_TYPE IDENTIFIER METHOD_INVOCATION MEMBER_SELECT IDENTIFIER ENHANCED_FOR_LOOP VARIABLE IDENTIFIER IDENTIFIER BLOCK EXPRESSION_STATEMENT METHOD_INVOCATION MEMBER_SELECT IDENTIFIER	FALSE
com.mountainminds.eclemma.internal.ui	com.mountainminds.eclemma.internal.ui.ScopeViewer	com.mountainminds.eclemma.internal.ui.ScopeViewer fireSelectionEvent()	2	0	5	29	20	814.6834458862678	0.041778638250577836	1	1	0	6	0	0	1	6.5	1	0	0	0	1	125.33591475173351	13	2	16	1	5	1	NORMAL	METHOD PRIMITIVE_TYPE BLOCK VARIABLE IDENTIFIER NEW_CLASS IDENTIFIER IDENTIFIER METHOD_INVOCATION IDENTIFIER ENHANCED_FOR_LOOP VARIABLE IDENTIFIER IDENTIFIER BLOCK EXPRESSION_STATEMENT METHOD_INVOCATION MEMBER_SELECT IDENTIFIER IDENTIFIER	FALSE
com.mountainminds.eclemma.internal.ui.actions	com.mountainminds.eclemma.internal.ui.actions.CoverageLastAction	com.mountainminds.eclemma.internal.ui.actions.CoverageLastAction getMode()	1	0	2	13	12	195.73895253937516	0.015534837503125011	1	0	0	4	0	0	1	4.2	0	0	0	0	0	46.604512509375034	6	1	7	0	1	0	GETTER	METHOD ANNOTATION IDENTIFIER IDENTIFIER BLOCK RETURN MEMBER_SELECT IDENTIFIER	FALSE
com.mountainminds.eclemma.core	com.mountainminds.eclemma.core.ICorePreferences	com.mountainminds.eclemma.core.ICorePreferences getAutoRemoveSessions()	1	6	1	5	5	17.414460711655217	0.0038698801581456034	0	0	0	1	1	0	1	1.5	0	0	0	0	0	11.60964047443681	2	0	3	0	0	0	INTERFACE	METHOD PRIMITIVE_TYPE	FALSE
com.mountainminds.eclemma.internal.core.analysis	com.mountainminds.eclemma.internal.core.analysis.BinarySignatureResolverTest	com.mountainminds.eclemma.internal.core.analysis.BinarySignatureResolverTest setup()	1	0	9	71	36	2329.448899688334	0.1223548917008014	1	1	0	14	0	0	1	6.346153846153846	2	1	0	0	0	367.0646751024042	33	7	38	0	11	0	TESTCODE	METHOD ANNOTATION IDENTIFIER PRIMITIVE_TYPE IDENTIFIER BLOCK EXPRESSION_STATEMENT ASSIGNMENT IDENTIFIER NEW_CLASS IDENTIFIER EXPRESSION_STATEMENT METHOD_INVOCATION MEMBER_SELECT IDENTIFIER VARIABLE IDENTIFIER METHOD_INVOCATION MEMBER_SELECT IDENTIFIER STRING_LITERAL STRING_LITERAL NEW_CLASS IDENTIFIER STRING_LITERAL NULL_LITERAL EXPRESSION_STATEMENT METHOD_INVOCATION MEMBER_SELECT IDENTIFIER EXPRESSION_STATEMENT METHOD_INVOCATION MEMBER_SELECT IDENTIFIER VARIABLE IDENTIFIER METHOD_INVOCATION MEMBER_SELECT METHOD_INVOCATION MEMBER_SELECT IDENTIFIER STRING_LITERAL STRING_LITERAL EXPRESSION_STATEMENT ASSIGNMENT IDENTIFIER METHOD_INVOCATION MEMBER_SELECT IDENTIFIER EXPRESSION_STATEMENT METHOD_INVOCATION IDENTIFIER	FALSE
com.mountainminds.eclemma.internal.core	com.mountainminds.eclemma.internal.core.SessionManagerTest	com.mountainminds.eclemma.internal.core.SessionManagerTest testRefreshActivateSession2()	1	0	7	44	24	1109.56092517452	0.06724611667724363	1	1	0	9	0	0	1	5.5	1	0	0	0	0	201.7383500317309	22	8	22	0	7	0	TESTCODE	METHOD ANNOTATION IDENTIFIER PRIMITIVE_TYPE BLOCK VARIABLE IDENTIFIER NEW_CLASS IDENTIFIER EXPRESSION_STATEMENT METHOD_INVOCATION MEMBER_SELECT IDENTIFIER IDENTIFIER BOOLEAN_LITERAL NULL_LITERAL EXPRESSION_STATEMENT METHOD_INVOCATION MEMBER_SELECT IDENTIFIER EXPRESSION_STATEMENT METHOD_INVOCATION MEMBER_SELECT IDENTIFIER EXPRESSION_STATEMENT METHOD_INVOCATION MEMBER_SELECT IDENTIFIER IDENTIFIER EXPRESSION_STATEMENT METHOD_INVOCATION IDENTIFIER IDENTIFIER IDENTIFIER	FALSE
com.mountainminds.eclemma.internal.core	com.mountainminds.eclemma.internal.core.SessionExporter	com.mountainminds.eclemma.internal.core.SessionExporter createReport(LIProgressMonitor;)	4	0	19	173	65	11583.138846034786	0.3472898772179742	1	1	0	29	0	1	1	11.117647058823529	7	1	0	1	3	1041.8696316539226	81	25	92	3	27	2	NORMAL	METHOD PRIMITIVE_TYPE VARIABLE IDENTIFIER IDENTIFIER IDENTIFIER BLOCK VARIABLE PRIMITIVE_TYPE METHOD_INVOCATION MEMBER_SELECT METHOD_INVOCATION MEMBER_SELECT IDENTIFIER EXPRESSION_STATEMENT METHOD_INVOCATION MEMBER_SELECT IDENTIFIER METHOD_INVOCATION MEMBER_SELECT IDENTIFIER MEMBER_SELECT IDENTIFIER METHOD_INVOCATION MEMBER_SELECT IDENTIFIER MULTIPLY IDENTIFIER INT_LITERAL VARIABLE IDENTIFIER NEW_CLASS IDENTIFIER VARIABLE IDENTIFIER METHOD_INVOCATION MEMBER_SELECT IDENTIFIER IDENTIFIER NEW_CLASS IDENTIFIER IDENTIFIER IDENTIFIER VARIABLE IDENTIFIER METHOD_INVOCATION IDENTIFIER EXPRESSION_STATEMENT METHOD_INVOCATION MEMBER_SELECT IDENTIFIER METHOD_INVOCATION MEMBER_SELECT IDENTIFIER METHOD_INVOCATION MEMBER_SELECT IDENTIFIER VARIABLE IDENTIFIER METHOD_INVOCATION MEMBER_SELECT IDENTIFIER METHOD_INVOCATION MEMBER_SELECT IDENTIFIER ENHANCED_FOR_LOOP VARIABLE IDENTIFIER METHOD_INVOCATION MEMBER_SELECT IDENTIFIER BLOCK VARIABLE IDENTIFIER METHOD_INVOCATION MEMBER_SELECT IDENTIFIER METHOD_INVOCATION MEMBER_SELECT IDENTIFIER ENHANCED_FOR_LOOP VARIABLE IDENTIFIER METHOD_INVOCATION MEMBER_SELECT IDENTIFIER BLOCK VARIABLE IDENTIFIER TYPE_CAST IDENTIFIER METHOD_INVOCATION MEMBER_SELECT IDENTIFIER IDENTIFIER IF PARENTHESIZED NOT_EQUAL_TO IDENTIFIER NULL_LITERAL BLOCK EXPRESSION_STATEMENT METHOD_INVOCATION MEMBER_SELECT IDENTIFIER IDENTIFIER METHOD_INVOCATION IDENTIFIER IDENTIFIER EXPRESSION_STATEMENT METHOD_INVOCATION MEMBER_SELECT IDENTIFIER INT_LITERAL EXPRESSION_STATEMENT METHOD_INVOCATION MEMBER_SELECT IDENTIFIER EXPRESSION_STATEMENT METHOD_INVOCATION MEMBER_SELECT IDENTIFIER	FALSE
com.mountainminds.eclemma.internal.core	com.mountainminds.eclemma.internal.core.DebugOptions$ITracer	com.mountainminds.eclemma.internal.core.DebugOptions$ITracer stopMemoryUsage(LString;)	1	6	1	7	7	29.47722668160484	0.00655049481813441	1	0	0	1	1	1	1	1.5	0	0	0	0	0	19.651484454403228	4	0	3	0	0	0	INTERFACE	METHOD PRIMITIVE_TYPE VARIABLE IDENTIFIER	FALSE
signatureresolver	signatureresolver.Samples	signatureresolver.Samples method_parameterizedTypeSuper(LGeneric;)	2	1	1	11	11	95.1343695125257	0.012684582601670092	1	0	0	2	1	1	0	2.5	0	0	0	0	0	38.053747805010275	6	0	5	0	0	0	EMPTY_METHOD	METHOD PRIMITIVE_TYPE VARIABLE PARAMETERIZED_TYPE IDENTIFIER SUPER_WILDCARD IDENTIFIER BLOCK	FALSE
com.mountainminds.eclemma.core.launching	com.mountainminds.eclemma.core.launching.JavaApplicationLauncherTest	com.mountainminds.eclemma.core.launching.JavaApplicationLauncherTest teardown()	1	0	3	20	14	342.6619429851844	0.025382366147050694	1	1	0	5	0	0	1	4.5	0	1	0	0	0	76.14709844115208	9	2	11	0	0	0	TESTCODE	METHOD ANNOTATION IDENTIFIER PRIMITIVE_TYPE IDENTIFIER BLOCK EXPRESSION_STATEMENT METHOD_INVOCATION MEMBER_SELECT IDENTIFIER EXPRESSION_STATEMENT METHOD_INVOCATION MEMBER_SELECT IDENTIFIER	FALSE
com.mountainminds.eclemma.core	com.mountainminds.eclemma.core.JavaProjectKit	com.mountainminds.eclemma.core.JavaProjectKit assertNoErrors()	4	0	10	95	42	6403.376939549778	0.17075671838799408	1	1	0	14	0	0	1	12.5	2	1	0	1	3	512.2701551639823	45	13	50	3	16	1	NORMAL	METHOD PRIMITIVE_TYPE IDENTIFIER BLOCK VARIABLE ARRAY_TYPE IDENTIFIER METHOD_INVOCATION MEMBER_SELECT IDENTIFIER MEMBER_SELECT IDENTIFIER BOOLEAN_LITERAL MEMBER_SELECT IDENTIFIER IF PARENTHESIZED GREATER_THAN MEMBER_SELECT IDENTIFIER INT_LITERAL BLOCK FOR_LOOP VARIABLE PRIMITIVE_TYPE INT_LITERAL LESS_THAN IDENTIFIER MEMBER_SELECT IDENTIFIER EXPRESSION_STATEMENT POSTFIX_INCREMENT IDENTIFIER BLOCK VARIABLE IDENTIFIER TYPE_CAST IDENTIFIER METHOD_INVOCATION MEMBER_SELECT ARRAY_ACCESS IDENTIFIER IDENTIFIER MEMBER_SELECT IDENTIFIER IF PARENTHESIZED NOT_EQUAL_TO IDENTIFIER NULL_LITERAL BLOCK EXPRESSION_STATEMENT METHOD_INVOCATION MEMBER_SELECT IDENTIFIER METHOD_INVOCATION MEMBER_SELECT IDENTIFIER METHOD_INVOCATION MEMBER_SELECT ARRAY_ACCESS IDENTIFIER IDENTIFIER MEMBER_SELECT IDENTIFIER LESS_THAN METHOD_INVOCATION MEMBER_SELECT IDENTIFIER MEMBER_SELECT IDENTIFIER	FALSE
com.mountainminds.eclemma.internal.ui.annotation	com.mountainminds.eclemma.internal.ui.annotation.CoverageAnnotationModel	com.mountainminds.eclemma.internal.ui.annotation.CoverageAnnotationModel removeAnnotation(LAnnotation;)	1	3	2	12	11	124.53953827094271	0.01383772647454919	1	1	0	3	1	1	1	3.0	0	0	1	0	0	41.51317942364757	5	0	7	0	1	0	NORMAL	METHOD PRIMITIVE_TYPE VARIABLE IDENTIFIER BLOCK THROW NEW_CLASS IDENTIFIER	FALSE
com.mountainminds.eclemma.internal.ui	com.mountainminds.eclemma.internal.ui.ScopeViewer	com.mountainminds.eclemma.internal.ui.ScopeViewer getSelection()	1	1	2	15	12	188.21053128786073	0.017924812503605784	1	1	0	3	1	0	1	3.5	0	0	0	0	0	53.77443751081735	5	0	10	0	2	0	GETTER	METHOD IDENTIFIER BLOCK RETURN NEW_CLASS IDENTIFIER METHOD_INVOCATION MEMBER_SELECT METHOD_INVOCATION IDENTIFIER	FALSE
com.mountainminds.eclemma.internal.ui.annotation	com.mountainminds.eclemma.internal.ui.annotation.EditorTracker	com.mountainminds.eclemma.internal.ui.annotation.EditorTracker <init>(LIWorkbench;)	2	0	7	41	22	1139.2132619611125	0.06094556545470973	1	1	0	8	0	1	1	6.230769230769231	0	0	0	0	1	182.83669636412918	18	6	23	1	4	1	CONSTRUCTOR	METHOD VARIABLE IDENTIFIER BLOCK EXPRESSION_STATEMENT ASSIGNMENT MEMBER_SELECT IDENTIFIER IDENTIFIER ENHANCED_FOR_LOOP VARIABLE IDENTIFIER METHOD_INVOCATION MEMBER_SELECT IDENTIFIER BLOCK EXPRESSION_STATEMENT METHOD_INVOCATION MEMBER_SELECT METHOD_INVOCATION MEMBER_SELECT IDENTIFIER IDENTIFIER EXPRESSION_STATEMENT METHOD_INVOCATION MEMBER_SELECT IDENTIFIER IDENTIFIER EXPRESSION_STATEMENT METHOD_INVOCATION IDENTIFIER	FALSE
com.mountainminds.eclemma.core	com.mountainminds.eclemma.core.ICorePreferences	com.mountainminds.eclemma.core.ICorePreferences getDefaultScopeSameProjectOnly()	1	8	1	5	5	17.414460711655217	0.0038698801581456034	0	0	0	1	1	0	1	1.5	0	0	0	0	0	11.60964047443681	2	0	3	0	0	0	INTERFACE	METHOD PRIMITIVE_TYPE	FALSE
com.mountainminds.eclemma.internal.core	com.mountainminds.eclemma.internal.core.DebugOptions$PrintStreamTracer	com.mountainminds.eclemma.internal.core.DebugOptions$PrintStreamTracer startMemoryUsage()	1	0	3	31	18	575.8287342900792	0.043089225014903886	1	1	0	4	0	0	1	4.454545454545454	1	0	0	0	0	129.26767504471167	14	3	17	0	3	0	NORMAL	METHOD PRIMITIVE_TYPE BLOCK VARIABLE IDENTIFIER METHOD_INVOCATION MEMBER_SELECT IDENTIFIER EXPRESSION_STATEMENT METHOD_INVOCATION MEMBER_SELECT IDENTIFIER METHOD_INVOCATION MEMBER_SELECT IDENTIFIER MINUS METHOD_INVOCATION MEMBER_SELECT IDENTIFIER METHOD_INVOCATION MEMBER_SELECT IDENTIFIER	FALSE
signatureresolver	signatureresolver.Samples	signatureresolver.Samples method_Inner(LInner;)	1	1	1	6	6	15.509775004326936	0.005169925001442312	1	0	0	2	1	1	0	1.0	0	0	0	0	0	15.509775004326936	4	0	2	0	0	0	EMPTY_METHOD	METHOD PRIMITIVE_TYPE VARIABLE IDENTIFIER BLOCK	FALSE
com.mountainminds.eclemma.internal.ui	com.mountainminds.eclemma.internal.ui.EclEmmaUIPlugin$ISessionListener	com.mountainminds.eclemma.internal.ui.EclEmmaUIPlugin$ISessionListener sessionAdded(LICoverageSession;)	2	0	3	27	17	331.08449014127757	0.03678716557125306	1	1	0	6	0	1	1	3.0	0	0	0	0	1	110.36149671375918	11	1	16	1	3	0	ANONYMOUS	METHOD PRIMITIVE_TYPE VARIABLE IDENTIFIER BLOCK IF PARENTHESIZED METHOD_INVOCATION MEMBER_SELECT METHOD_INVOCATION IDENTIFIER MEMBER_SELECT IDENTIFIER BLOCK EXPRESSION_STATEMENT METHOD_INVOCATION MEMBER_SELECT METHOD_INVOCATION MEMBER_SELECT METHOD_INVOCATION IDENTIFIER NEW_CLASS IDENTIFIER METHOD PRIMITIVE_TYPE BLOCK EXPRESSION_STATEMENT METHOD_INVOCATION IDENTIFIER	FALSE
com.mountainminds.eclemma.internal.ui.coverageview	com.mountainminds.eclemma.internal.ui.coverageview.ViewSettings$ICounterMode_3	com.mountainminds.eclemma.internal.ui.coverageview.ViewSettings$ICounterMode_3 getActionLabel()	1	0	2	10	10	99.65784284662087	0.01107309364962454	1	0	0	3	0	0	1	3.0	0	0	0	0	0	33.219280948873624	4	1	6	0	1	0	ANONYMOUS	METHOD IDENTIFIER BLOCK RETURN MEMBER_SELECT IDENTIFIER	FALSE
com.mountainminds.eclemma.internal.core	com.mountainminds.eclemma.internal.core.SessionManagerTest$DummyLaunchConfiguration	com.mountainminds.eclemma.internal.core.SessionManagerTest$DummyLaunchConfiguration getMemento()	1	0	2	10	10	99.65784284662087	0.01107309364962454	1	0	0	3	0	0	1	3.0	0	1	0	0	0	33.219280948873624	4	0	6	0	1	0	TESTCODE	METHOD IDENTIFIER IDENTIFIER BLOCK RETURN NULL_LITERAL	FALSE
org.eclemma.runtime.equinox.internal	org.eclemma.runtime.equinox.internal.PropertyUtils	org.eclemma.runtime.equinox.internal.PropertyUtils listToString(LList;)	2	8	8	51	28	2443.57850688188	0.08172503367497927	1	1	0	7	1	1	1	9.966666666666667	1	0	0	0	1	245.1751010249378	23	4	28	1	7	1	NORMAL	METHOD IDENTIFIER VARIABLE IDENTIFIER BLOCK VARIABLE IDENTIFIER NEW_CLASS IDENTIFIER FOR_LOOP VARIABLE PRIMITIVE_TYPE INT_LITERAL LESS_THAN IDENTIFIER METHOD_INVOCATION MEMBER_SELECT IDENTIFIER EXPRESSION_STATEMENT POSTFIX_INCREMENT IDENTIFIER BLOCK EXPRESSION_STATEMENT METHOD_INVOCATION MEMBER_SELECT IDENTIFIER PLUS STRING_LITERAL METHOD_INVOCATION MEMBER_SELECT IDENTIFIER IDENTIFIER RETURN METHOD_INVOCATION MEMBER_SELECT IDENTIFIER INT_LITERAL	FALSE
com.mountainminds.eclemma.internal.ui.coverageview	com.mountainminds.eclemma.internal.ui.coverageview.ViewSettings$ICounterMode_1	com.mountainminds.eclemma.internal.ui.coverageview.ViewSettings$ICounterMode_1 getIdx()	1	0	2	8	8	60.0	0.008	0	0	0	3	0	0	1	2.5	0	0	0	0	0	24.0	3	0	5	0	1	0	ANONYMOUS	METHOD PRIMITIVE_TYPE BLOCK RETURN INT_LITERAL	FALSE
signatureresolver	signatureresolver.Samples$Inner	signatureresolver.Samples$Inner test_innerClassTypeVariable(LS;)	1	1	1	6	6	15.509775004326936	0.005169925001442312	1	0	0	2	1	1	0	1.0	0	0	0	0	0	15.509775004326936	4	0	2	0	0	0	EMPTY_METHOD	METHOD PRIMITIVE_TYPE VARIABLE IDENTIFIER BLOCK	FALSE
com.mountainminds.eclemma.ui.launching	com.mountainminds.eclemma.ui.launching.CoverageLaunchShortcut	com.mountainminds.eclemma.ui.launching.CoverageLaunchShortcut launch(LIEditorPart;LString;)	2	0	4	30	20	691.5084951819779	0.043219280948873624	1	1	0	6	0	2	1	5.333333333333333	1	0	0	0	1	129.65784284662087	16	4	14	1	4	0	NORMAL	METHOD PRIMITIVE_TYPE VARIABLE IDENTIFIER VARIABLE IDENTIFIER BLOCK VARIABLE IDENTIFIER METHOD_INVOCATION IDENTIFIER IF PARENTHESIZED NOT_EQUAL_TO IDENTIFIER NULL_LITERAL BLOCK EXPRESSION_STATEMENT METHOD_INVOCATION MEMBER_SELECT IDENTIFIER IDENTIFIER MEMBER_SELECT IDENTIFIER	FALSE
com.mountainminds.eclemma.internal.ui.wizards	com.mountainminds.eclemma.internal.ui.wizards.SessionExportPage1	com.mountainminds.eclemma.internal.ui.wizards.SessionExportPage1 openFileDialog()	2	1	9	76	34	3236.0687551083684	0.12888239197834195	1	1	0	11	1	0	1	8.369565217391305	3	0	0	0	1	386.6471759350258	35	11	41	1	12	0	NORMAL	METHOD PRIMITIVE_TYPE BLOCK VARIABLE IDENTIFIER NEW_CLASS IDENTIFIER METHOD_INVOCATION IDENTIFIER MEMBER_SELECT IDENTIFIER EXPRESSION_STATEMENT METHOD_INVOCATION MEMBER_SELECT IDENTIFIER MEMBER_SELECT IDENTIFIER EXPRESSION_STATEMENT METHOD_INVOCATION MEMBER_SELECT IDENTIFIER METHOD_INVOCATION MEMBER_SELECT IDENTIFIER VARIABLE IDENTIFIER METHOD_INVOCATION MEMBER_SELECT METHOD_INVOCATION IDENTIFIER EXPRESSION_STATEMENT METHOD_INVOCATION MEMBER_SELECT IDENTIFIER NEW_ARRAY IDENTIFIER PLUS STRING_LITERAL IDENTIFIER STRING_LITERAL VARIABLE IDENTIFIER METHOD_INVOCATION MEMBER_SELECT IDENTIFIER IF PARENTHESIZED NOT_EQUAL_TO IDENTIFIER NULL_LITERAL BLOCK EXPRESSION_STATEMENT METHOD_INVOCATION MEMBER_SELECT IDENTIFIER IDENTIFIER	FALSE
com.mountainminds.eclemma.core.launching	com.mountainminds.eclemma.core.launching.ICoverageLaunch	com.mountainminds.eclemma.core.launching.ICoverageLaunch getScope()	1	6	1	8	8	60.0	0.008	1	0	0	1	1	0	1	2.5	0	0	0	0	0	24.0	3	0	5	0	0	0	INTERFACE	METHOD PARAMETERIZED_TYPE IDENTIFIER IDENTIFIER	FALSE
com.mountainminds.eclemma.internal.core	com.mountainminds.eclemma.internal.core.SessionManagerTest$DummyLaunchConfiguration	com.mountainminds.eclemma.internal.core.SessionManagerTest$DummyLaunchConfiguration getFile()	1	0	2	8	8	60.0	0.008	1	0	0	3	0	0	1	2.5	0	0	0	0	0	24.0	3	0	5	0	1	0	TESTCODE	METHOD IDENTIFIER BLOCK RETURN NULL_LITERAL	FALSE
com.mountainminds.eclemma.core	com.mountainminds.eclemma.core.JavaProjectKit	com.mountainminds.eclemma.core.JavaProjectKit createPackage(LIPackageFragmentRoot;LString;)	1	0	2	20	17	343.34687866502856	0.027249752275002266	1	1	0	4	0	2	1	4.2	0	1	0	0	0	81.7492568250068	12	2	8	0	4	0	NORMAL	METHOD IDENTIFIER VARIABLE IDENTIFIER VARIABLE IDENTIFIER IDENTIFIER BLOCK RETURN METHOD_INVOCATION MEMBER_SELECT IDENTIFIER IDENTIFIER BOOLEAN_LITERAL NULL_LITERAL	FALSE
com.mountainminds.eclemma.core	com.mountainminds.eclemma.core.ScopeUtils	com.mountainminds.eclemma.core.ScopeUtils getOverallScope(LILaunchConfiguration;)	1	9	3	45	28	1703.6064005041633	0.07211032383086406	1	1	0	7	1	1	1	7.875	1	1	0	1	0	216.33097149259217	21	4	24	0	6	0	NORMAL	METHOD PARAMETERIZED_TYPE IDENTIFIER IDENTIFIER VARIABLE IDENTIFIER IDENTIFIER BLOCK VARIABLE IDENTIFIER TYPE_CAST IDENTIFIER METHOD_INVOCATION MEMBER_SELECT ARRAY_ACCESS METHOD_INVOCATION MEMBER_SELECT METHOD_INVOCATION MEMBER_SELECT IDENTIFIER METHOD_INVOCATION MEMBER_SELECT IDENTIFIER MEMBER_SELECT IDENTIFIER INT_LITERAL RETURN METHOD_INVOCATION MEMBER_SELECT IDENTIFIER IDENTIFIER	FALSE
com.mountainminds.eclemma.internal.ui	com.mountainminds.eclemma.internal.ui.ScopeViewer$PackageFragmentRootLabelProvider	com.mountainminds.eclemma.internal.ui.ScopeViewer$PackageFragmentRootLabelProvider getImage(LObject;)	1	0	2	14	11	203.4145791758731	0.016144014220307392	1	1	0	3	0	1	1	4.199999999999999	0	0	0	0	0	48.43204266092217	7	2	7	0	2	0	GETTER	METHOD IDENTIFIER VARIABLE IDENTIFIER BLOCK RETURN METHOD_INVOCATION MEMBER_SELECT IDENTIFIER IDENTIFIER	FALSE
com.mountainminds.eclemma.internal.ui.coverageview	com.mountainminds.eclemma.internal.ui.coverageview.ViewSettings$ICounterMode_0	com.mountainminds.eclemma.internal.ui.coverageview.ViewSettings$ICounterMode_0 getCounter(LICoverageNode;)	1	0	2	13	11	161.9013997522255	0.01499087034742829	1	1	0	3	0	1	1	3.5999999999999996	0	0	0	0	0	44.97261104228487	6	1	7	0	1	0	ANONYMOUS	METHOD IDENTIFIER VARIABLE IDENTIFIER BLOCK RETURN METHOD_INVOCATION MEMBER_SELECT IDENTIFIER	FALSE
com.mountainminds.eclemma.internal.core	com.mountainminds.eclemma.internal.core.SessionManagerTest	com.mountainminds.eclemma.internal.core.SessionManagerTest testRemoveSession3()	1	0	11	78	30	2783.5452105997415	0.1275791554858215	1	1	0	13	0	0	1	7.2727272727272725	2	0	0	0	0	382.73746645746445	40	15	38	0	16	0	TESTCODE	METHOD ANNOTATION IDENTIFIER PRIMITIVE_TYPE BLOCK VARIABLE IDENTIFIER NEW_CLASS IDENTIFIER VARIABLE IDENTIFIER NEW_CLASS IDENTIFIER EXPRESSION_STATEMENT METHOD_INVOCATION MEMBER_SELECT IDENTIFIER IDENTIFIER BOOLEAN_LITERAL NULL_LITERAL EXPRESSION_STATEMENT METHOD_INVOCATION MEMBER_SELECT IDENTIFIER IDENTIFIER BOOLEAN_LITERAL NULL_LITERAL EXPRESSION_STATEMENT METHOD_INVOCATION MEMBER_SELECT IDENTIFIER EXPRESSION_STATEMENT METHOD_INVOCATION MEMBER_SELECT IDENTIFIER IDENTIFIER EXPRESSION_STATEMENT METHOD_INVOCATION IDENTIFIER METHOD_INVOCATION MEMBER_SELECT IDENTIFIER IDENTIFIER METHOD_INVOCATION MEMBER_SELECT IDENTIFIER EXPRESSION_STATEMENT METHOD_INVOCATION MEMBER_SELECT IDENTIFIER IDENTIFIER EXPRESSION_STATEMENT METHOD_INVOCATION MEMBER_SELECT IDENTIFIER IDENTIFIER EXPRESSION_STATEMENT METHOD_INVOCATION IDENTIFIER IDENTIFIER IDENTIFIER	FALSE
com.mountainminds.eclemma.internal.ui	com.mountainminds.eclemma.internal.ui.ScopeViewer	com.mountainminds.eclemma.internal.ui.ScopeViewer selectAll()	1	0	3	14	11	121.08010665230543	0.016144014220307392	0	1	0	4	0	0	1	2.5	0	0	0	0	0	48.43204266092217	6	1	8	0	1	0	NORMAL	METHOD PRIMITIVE_TYPE BLOCK EXPRESSION_STATEMENT METHOD_INVOCATION MEMBER_SELECT IDENTIFIER BOOLEAN_LITERAL EXPRESSION_STATEMENT METHOD_INVOCATION IDENTIFIER	FALSE
com.mountainminds.eclemma.internal.core	com.mountainminds.eclemma.internal.core.SessionManagerTest$DummyLaunchConfiguration	com.mountainminds.eclemma.internal.core.SessionManagerTest$DummyLaunchConfiguration getAttribute(LString;LSet;)	1	0	2	21	19	495.59154323508494	0.029735492594105097	1	0	0	4	0	2	1	5.555555555555555	0	1	0	0	0	89.20647778231529	10	0	11	0	1	0	TESTCODE	METHOD PARAMETERIZED_TYPE IDENTIFIER UNBOUNDED_WILDCARD VARIABLE IDENTIFIER VARIABLE ANNOTATION IDENTIFIER STRING_LITERAL IDENTIFIER IDENTIFIER BLOCK RETURN NULL_LITERAL	FALSE
com.mountainminds.eclemma.internal.ui.coverageview	com.mountainminds.eclemma.internal.ui.coverageview.ViewSettings	com.mountainminds.eclemma.internal.ui.coverageview.ViewSettings getCounterMode()	1	0	2	10	10	99.65784284662087	0.01107309364962454	1	0	0	3	0	0	1	3.0	0	0	0	0	0	33.219280948873624	4	2	6	0	2	0	GETTER	METHOD IDENTIFIER BLOCK RETURN ARRAY_ACCESS IDENTIFIER IDENTIFIER	FALSE
com.mountainminds.eclemma.internal.core	com.mountainminds.eclemma.internal.core.SessionManagerTest$RecordingListener	com.mountainminds.eclemma.internal.core.SessionManagerTest$RecordingListener sessionAdded(LICoverageSession;)	1	0	3	19	12	243.2653125489356	0.022704762504567322	1	1	0	4	0	1	1	3.5714285714285716	0	0	0	0	0	68.11428751370197	10	3	9	0	2	0	TESTCODE	METHOD PRIMITIVE_TYPE VARIABLE IDENTIFIER BLOCK EXPRESSION_STATEMENT METHOD_INVOCATION MEMBER_SELECT IDENTIFIER STRING_LITERAL EXPRESSION_STATEMENT METHOD_INVOCATION MEMBER_SELECT IDENTIFIER IDENTIFIER	FALSE
com.mountainminds.eclemma.internal.core	com.mountainminds.eclemma.internal.core.SessionManager	com.mountainminds.eclemma.internal.core.SessionManager fireSessionAdded(LICoverageSession;)	2	1	4	26	19	736.3074356635547	0.03681537178317774	1	1	0	5	1	1	1	6.666666666666666	0	0	0	0	1	110.44611534953322	12	2	14	1	3	1	NORMAL	METHOD PRIMITIVE_TYPE VARIABLE IDENTIFIER BLOCK ENHANCED_FOR_LOOP VARIABLE IDENTIFIER NEW_CLASS PARAMETERIZED_TYPE IDENTIFIER IDENTIFIER IDENTIFIER BLOCK EXPRESSION_STATEMENT METHOD_INVOCATION MEMBER_SELECT IDENTIFIER IDENTIFIER	FALSE
com.mountainminds.eclemma.core	com.mountainminds.eclemma.core.CoverageTools	com.mountainminds.eclemma.core.CoverageTools <init>()	1	1	1	4	4	12.0	0.0026666666666666666	0	0	0	2	1	0	1	1.5	0	0	0	0	0	8.0	1	0	3	0	0	0	EMPTY_CONSTRUCTOR	METHOD BLOCK	FALSE
